{
  "compositions": [
    {
      "composition_id": "pg-milvus-m16",
      "embedding": {
        "dim": 768,
        "model_id": "bge-base"
      },
      "endpoint_refs": {
        "MILVUS_URI": "${BENCH_MILVUS_URI}",
        "PG_URL": "${BENCH_PG_URL}"
      },
      "execution_mode": {
        "default": "parallel",
        "per_query_override": true
      },
      "index_params": {
        "lists": 100,
        "m": 16
      },
      "metadata_provider": "postgres",
      "vector_provider": "milvus"
    }
  ],
  "corpus": {
    "alias": "demo-frozen-v1",
    "dataset_version": "demo-frozen-v1",
    "ref": "cas:0000000000000000000000000000000000000000000000000000000000000000",
    "registry": "demo-data/eval/corpus-registry.json"
  },
  "cost_controls": {
    "dry_run": false,
    "max_event_count": 1000000,
    "timeout_ms": 3600000
  },
  "manifest_id": "vec-b5-pg-milvus-m16",
  "metrics": {
    "eligible_set_identity": true,
    "index_build_time": true,
    "index_size": true,
    "latency_percentiles": [
      50,
      95,
      99
    ],
    "ndcg_at_k": [
      10
    ],
    "recall_at_k": [
      10
    ],
    "reproducibility_flags": true,
    "topology_per_query": true
  },
  "output_sink": {
    "file": {
      "atomic_write": true,
      "base_path": "runs/vec-b5-pg-milvus-m16"
    }
  },
  "reproducibility": {
    "environment_record": "lightweight",
    "seed": 7348291,
    "verify_corpus_hash": true
  },
  "schema_version": "0.2.0"
}